{
  "schema_version": "1.0",
  "data_classification": "non_live_contract_fixture",
  "action_id": "00000000-0000-4000-8000-000000000102",
  "action": "refine_session_recommendation",
  "decision_id": "00000000-0000-4000-8000-000000000029",
  "context_version": 1,
  "input_turn_id": "00000000-0000-4000-8000-000000000202",
  "evaluated_product_ids": [
    "apple-iphone-17-pro-max",
    "samsung-galaxy-s25-ultra-512gb"
  ],
  "canonical_piqscore_snapshot_sha256": "ffffffffffffffffffffffffffffffffffffffffffffffffffffffffffffffff",
  "response_source": "session_refinement",
  "requires_research_confirmation": false,
  "affiliate_influence": false,
  "session_priorities": {
    "battery": "higher",
    "storage": "preserve"
  },
  "recommendation_snapshot_sha256": "cccccccccccccccccccccccccccccccccccccccccccccccccccccccccccccccc"
}
